{
  "record_type": "studio_state_delta",
  "contract_version": "V0",
  "source_report_id": "semantic-report-001",
  "source_task_id": "semantic-task-001",
  "generated_at": "2026-05-19T00:00:00Z",
  "evidence_added": [
    {
      "summary": "semantic fixture supporting evidence only",
      "status": "TESTED",
      "surface": "tools_scripts",
      "source": "semantic_fixture",
      "evidence": [
        "This evidence text must not promote tools_scripts into proven_surfaces by itself."
      ]
    }
  ],
  "risks_reduced": [],
  "risks_created": [
    {
      "summary": "semantic fixture open risk",
      "status": "UNKNOWN",
      "surface": "tools_scripts",
      "source": "semantic_fixture",
      "evidence": [
        "Risk propagation evidence."
      ]
    }
  ],
  "blockers_opened": [
    {
      "summary": "semantic fixture open blocker",
      "status": "BLOCKED",
      "surface": "canonical_docs",
      "source": "semantic_fixture",
      "evidence": [
        "Blocker propagation evidence."
      ]
    }
  ],
  "blockers_closed": [],
  "decision_debt_opened": [
    {
      "summary": "semantic fixture decision debt",
      "status": "UNKNOWN",
      "surface": "inference",
      "source": "semantic_fixture",
      "evidence": [
        "Decision debt propagation evidence."
      ]
    }
  ],
  "decision_debt_closed": [],
  "proven_surfaces": [
    "tests"
  ],
  "blocked_surfaces": [
    "canonical_docs"
  ],
  "next_best_mission": {
    "task_class": "control_plane_semantic_followup",
    "goal": "Verify semantic propagation through Studio state dry-run chain",
    "reason": "Fixture mission must reach current state and mission candidate.",
    "target_files": [
      "docs/control-plane/fixtures/studio_state_chain_semantic/README.md"
    ],
    "blocked_actions": [
      "runtime_activation",
      "training",
      "benchmark"
    ],
    "validation_plan": [
      "Run semantic chain dry-run validation only."
    ],
    "source": "semantic_fixture"
  },
  "forbidden_next_missions": [
    "runtime_activation",
    "agent_activation",
    "dataset_generation",
    "training",
    "benchmark",
    "model_promotion",
    "latest_json_creation",
    "lab_runs_creation",
    "public_claim",
    "codex_execution"
  ],
  "humangate_required": true,
  "status_by_surface": {
    "active_runtime_code": "UNKNOWN",
    "tests": "TESTED",
    "tools_scripts": "UNKNOWN",
    "artifacts_runtime_outputs": "UNKNOWN",
    "canonical_docs": "BLOCKED",
    "roadmap_docs_only": "UNKNOWN",
    "inference": "UNKNOWN"
  },
  "software_verdict": {
    "active_runtime_code": "UNKNOWN",
    "tests": "TESTED",
    "tools_scripts": "UNKNOWN",
    "artifacts_runtime_outputs": "UNKNOWN",
    "canonical_docs": "BLOCKED",
    "roadmap_docs_only": "UNKNOWN",
    "inference": "UNKNOWN"
  },
  "evidence_verdict": {
    "active_runtime_code": "UNKNOWN",
    "tests": "TESTED",
    "tools_scripts": "UNKNOWN",
    "artifacts_runtime_outputs": "UNKNOWN",
    "canonical_docs": "BLOCKED",
    "roadmap_docs_only": "UNKNOWN",
    "inference": "UNKNOWN"
  },
  "claim_verdict": {
    "active_runtime_code": "BLOCKED",
    "tests": "BLOCKED",
    "tools_scripts": "BLOCKED",
    "artifacts_runtime_outputs": "BLOCKED",
    "canonical_docs": "BLOCKED",
    "roadmap_docs_only": "BLOCKED",
    "inference": "BLOCKED"
  },
  "claim_posture": "NO_CLAIM_ALLOWED",
  "no_global_ready_verdict": true
}
