{
  "record_type": "studio_state_delta",
  "contract_version": "V0",
  "source_report_id": "fixture-report-001",
  "source_task_id": "fixture-task-001",
  "generated_at": "2026-05-19T00:00:00Z",
  "evidence_added": [
    {
      "summary": "validation passed: json_parseability",
      "status": "TESTED",
      "source": "validation_results",
      "evidence": [
        "Fixture schema parseability evidence."
      ]
    }
  ],
  "risks_reduced": [],
  "risks_created": [],
  "blockers_opened": [],
  "blockers_closed": [],
  "decision_debt_opened": [],
  "decision_debt_closed": [],
  "proven_surfaces": [
    "tests"
  ],
  "blocked_surfaces": [],
  "next_best_mission": null,
  "forbidden_next_missions": [
    "runtime_activation",
    "agent_activation",
    "decision_controller_activation",
    "search_backend_activation",
    "neural_agent_activation",
    "dataset_generation",
    "dataset_reset",
    "training",
    "benchmark",
    "model_checkpoint_creation",
    "model_promotion",
    "latest_json_creation",
    "lab_runs_creation",
    "lab_puzzles_creation",
    "public_claim",
    "release_automation"
  ],
  "humangate_required": true,
  "status_by_surface": {
    "active_runtime_code": "UNKNOWN",
    "tests": "TESTED",
    "tools_scripts": "UNKNOWN",
    "artifacts_runtime_outputs": "UNKNOWN",
    "canonical_docs": "UNKNOWN",
    "roadmap_docs_only": "UNKNOWN",
    "inference": "UNKNOWN"
  },
  "software_verdict": {
    "active_runtime_code": "UNKNOWN",
    "tests": "TESTED",
    "tools_scripts": "UNKNOWN",
    "artifacts_runtime_outputs": "UNKNOWN",
    "canonical_docs": "UNKNOWN",
    "roadmap_docs_only": "UNKNOWN",
    "inference": "UNKNOWN"
  },
  "evidence_verdict": {
    "active_runtime_code": "UNKNOWN",
    "tests": "TESTED",
    "tools_scripts": "UNKNOWN",
    "artifacts_runtime_outputs": "UNKNOWN",
    "canonical_docs": "UNKNOWN",
    "roadmap_docs_only": "UNKNOWN",
    "inference": "UNKNOWN"
  },
  "claim_verdict": {
    "active_runtime_code": "BLOCKED",
    "tests": "BLOCKED",
    "tools_scripts": "BLOCKED",
    "artifacts_runtime_outputs": "BLOCKED",
    "canonical_docs": "BLOCKED",
    "roadmap_docs_only": "BLOCKED",
    "inference": "BLOCKED"
  },
  "claim_posture": "NO_CLAIM_ALLOWED",
  "no_global_ready_verdict": true
}
